{
  "$schema": "http://json-schema.org/draft-07/schema#",
  "title": "Security Schema",
  "description": "Schema for defining application security settings",
  "type": "object",
  "properties": {
    "$schema": {
      "type": "string",
      "description": "Path to the JSON schema"
    },
    "authentication_required": {
      "type": "boolean",
      "description": "Whether authentication is required to access the application",
      "default": true
    },
    "registration": {
      "type": "object",
      "description": "Settings for user self-registration",
      "properties": {
        "allow": {
          "type": "boolean",
          "description": "Whether users can self-register via the login page (requires email confirmation)",
          "default": false
        },
        "role": {
          "type": "string",
          "description": "The default role assigned to new registered users",
          "default": "user"
        }
      },
      "default": {
        "allow": false,
        "role": "user"
      }
    },
    "roles": {
      "type": "array",
      "description": "Initial roles to seed. If not provided and authentication is required, 'admin' and 'user' roles are created by default.",
      "items": {
        "type": "object",
        "properties": {
          "name": { "type": "string" },
          "description": { "type": "string" },
          "profile_concept": {
            "type": "string",
            "description": "Business concept used as the per-user profile for this role. The generator links profile rows to auth users at login."
          }
        },
        "required": ["name"]
      }
    },
    "users": {
      "type": "array",
      "description": "Initial users to seed. If not provided and authentication is required, default users 'admin@test.com' and 'user@test.com' are created.",
      "items": {
        "type": "object",
        "properties": {
          "email": { "type": "string" },
          "password": { "type": "string" },
          "roles": {
            "type": "array",
            "items": { "type": "string" }
          }
        },
        "required": ["email", "password", "roles"]
      }
    },
    "sso": {
      "type": "object",
      "description": "SSO (Kerberos/OIDC via Keycloak) configuration for single sign-on login",
      "properties": {
        "enabled": {
          "type": "boolean",
          "description": "Whether SSO login is enabled",
          "default": false
        },
        "domain": {
          "type": "string",
          "description": "Kerberos realm / email domain for SSO users (e.g. 'dev.local')"
        },
        "role_claim": {
          "type": "string",
          "description": "Name of the JWT claim containing the user role(s) from the SSO provider",
          "default": "roles"
        },
        "default_role": {
          "type": "string",
          "description": "Role assigned when no matching role is found in the SSO claim",
          "default": "user"
        }
      },
      "default": {
        "enabled": false,
        "role_claim": "roles",
        "default_role": "user"
      }
    },
    "rules_level_1": {
      "type": "array",
      "description": "General security rules for role-based access control. Lower priority.",
      "items": { "$ref": "#/$defs/rule" },
      "default": [
        {"concept": "*", "role": "admin", "access": "write", "field": "*"},
        {"concept": "*", "role": "user", "access": "read", "field": "*"}
      ]
    },
    "rules_level_2": {
      "type": "array",
      "description": "Specific security rules for role-based access control. Medium priority.",
      "items": { "$ref": "#/$defs/rule" },
      "default": []
    },
    "rules_level_3": {
      "type": "array",
      "description": "Exception security rules for role-based access control. High priority.",
      "items": { "$ref": "#/$defs/rule" },
      "default": []
    }
  },
  "$defs": {
    "rule": {
      "type": "object",
      "properties": {
        "concept": { "type": "string", "description": "Concept name or '*' for all" },
        "role": { "type": "string", "description": "Role name (e.g., 'admin', 'user'). Use '_anon' for unauthenticated (anonymous) access — only 'read' is allowed for this built-in role." },
        "access": { "enum": ["read", "write", "owner_write"], "description": "Access level." },
        "field": { "type": "string", "description": "Field name or '*' for all fields", "default": "*" }
      },
      "required": ["concept", "role", "access"]
    }
  },
  "required": ["authentication_required"],
  "additionalProperties": false
}
